{
  "ambiguities": [
    {
      "blocking": false,
      "evidence_refs": [
        "capability:IFC2X3:IfcSpace"
      ],
      "id": "amb-room-verification",
      "message": "R001–R005 是否可推定为已核实房间？",
      "options": [
        "按已核实房间生成 IfcSpace，几何采用已给轮廓",
        "仅保留空间记录，不生成房间实体"
      ],
      "path": "/known_facts/storeys/0/spaces",
      "reason": "源记录称有显式空间记录但未形成几何围合候选，并明确“可否据此推定为已核实房间仍待进一步确认”；本次按已给轮廓保留空间记录。",
      "source_turns": [
        "turn-user-001"
      ]
    },
    {
      "blocking": false,
      "evidence_refs": [
        "capability:IFC2X3:IfcWall",
        "capability:IFC2X3:IfcSlab"
      ],
      "id": "amb-wall-exterior-interior-split",
      "message": "源记录未给出墙体的室内外分组，本次按楼板 L001 轮廓推导 exterior/interior。",
      "options": [
        "按楼板 L001 轮廓推导室内外分组（本次采用）",
        "由用户逐段指定室内外分组"
      ],
      "path": "/known_facts/storeys/0/walls",
      "reason": "当前 Design Brief 要求每层墙体归入 walls.exterior 与 walls.interior 两组，而源记录只给出墙体轴、厚度与高度；本次以“外墙外皮与楼板轮廓边重合”推导分组。",
      "source_turns": [
        "turn-user-001"
      ]
    },
    {
      "blocking": false,
      "evidence_refs": [
        "capability:IFC2X3:IfcWindow",
        "capability:IFC2X3:IfcWall"
      ],
      "id": "amb-window-storey-placement",
      "message": "N001–N003 在源记录中列于 S02 标高，但其宿主墙 W005、W007、W013 属于 S01。",
      "options": [
        "按宿主墙所在楼层归入 S01（本次采用）",
        "保留在 S02 并记录跨楼层宿主关系"
      ],
      "path": "/known_facts/storeys/0/windows",
      "reason": "源记录提示门窗宿主可能位于其他楼层；本次按宿主墙所属楼层把三个窗放入 S01，S02 仅保留标高记录。",
      "source_turns": [
        "turn-user-001"
      ]
    }
  ],
  "clarification_questions": [],
  "fact_sources": [
    {
      "evidence_refs": [
        "capability:IFC2X3:IfcBuildingStorey",
        "schema:bim-json-v2:entity"
      ],
      "path": "/known_facts/storeys",
      "source_turns": [
        "turn-user-001"
      ]
    },
    {
      "evidence_refs": [
        "capability:IFC2X3:IfcSpace",
        "schema:bim-json-v2:entity"
      ],
      "path": "/known_facts/storeys/0/spaces",
      "source_turns": [
        "turn-user-001"
      ]
    },
    {
      "evidence_refs": [
        "capability:IFC2X3:IfcWall",
        "schema:bim-json-v2:entity"
      ],
      "path": "/known_facts/storeys/0/walls",
      "source_turns": [
        "turn-user-001"
      ]
    },
    {
      "evidence_refs": [
        "capability:IFC2X3:IfcDoor",
        "schema:bim-json-v2:entity"
      ],
      "path": "/known_facts/storeys/0/doors",
      "source_turns": [
        "turn-user-001"
      ]
    },
    {
      "evidence_refs": [
        "capability:IFC2X3:IfcWindow",
        "schema:bim-json-v2:entity"
      ],
      "path": "/known_facts/storeys/0/windows",
      "source_turns": [
        "turn-user-001"
      ]
    },
    {
      "evidence_refs": [
        "capability:IFC2X3:IfcOpeningElement",
        "capability:IFC2X3:IfcRelVoidsElement",
        "capability:IFC2X3:IfcRelFillsElement"
      ],
      "path": "/known_facts/storeys/0/openings",
      "source_turns": [
        "turn-user-001"
      ]
    },
    {
      "evidence_refs": [
        "capability:IFC2X3:IfcSlab",
        "schema:bim-json-v2:entity"
      ],
      "path": "/known_facts/floor_slabs",
      "source_turns": [
        "turn-user-001"
      ]
    },
    {
      "evidence_refs": [
        "capability:IFC2X3:IfcCovering",
        "schema:bim-json-v2:entity"
      ],
      "path": "/known_facts/storeys/2/coverings",
      "source_turns": [
        "turn-user-001"
      ]
    },
    {
      "evidence_refs": [
        "schema:bim-json-v2:entity"
      ],
      "path": "/known_facts/semantic_requirements",
      "source_turns": [
        "turn-user-001"
      ]
    },
    {
      "evidence_refs": [
        "schema:bim-json-v2:root"
      ],
      "path": "/known_facts/appearance",
      "source_turns": [
        "turn-user-001"
      ]
    }
  ],
  "known_facts": {
    "appearance": {
      "profile": "neutral-architectural"
    },
    "floor_slabs": [
      {
        "category": "FLOOR",
        "id": "L001",
        "polygon": [
          [
            1026.5,
            -1020.0
          ],
          [
            1026.5,
            -620.0
          ],
          [
            541.0,
            -620.0
          ],
          [
            541.0,
            5354.0
          ],
          [
            1584.4,
            5354.0
          ],
          [
            1584.4,
            5692.1
          ],
          [
            1827.0,
            5692.1
          ],
          [
            1827.0,
            5817.1
          ],
          [
            3352.0,
            5817.1
          ],
          [
            3352.0,
            5696.0
          ],
          [
            6436.0,
            5696.0
          ],
          [
            6436.0,
            -430.7
          ],
          [
            6044.4,
            -430.7
          ],
          [
            6044.4,
            -1030.0
          ],
          [
            3809.4,
            -1030.0
          ],
          [
            3809.4,
            -500.0
          ],
          [
            3259.4,
            -500.0
          ],
          [
            3259.4,
            -1020.0
          ],
          [
            1026.5,
            -1020.0
          ]
        ],
        "storey": "storey-s01",
        "thickness_mm": 300.0,
        "top_elevation_mm": -1140.0
      }
    ],
    "plan_constraints": [],
    "semantic_requirements": [
      {
        "entity_id": "W001",
        "material": {
          "direction": "AXIS2",
          "direction_sense": "NEGATIVE",
          "kind": "material_layer_set_usage",
          "layer_set_name": "M01",
          "layers": [
            {
              "name": "默认墙",
              "thickness": 240.0
            }
          ],
          "offset_from_reference_line": 120.0
        },
        "scope": "direct",
        "source": "user"
      },
      {
        "entity_id": "W002",
        "material": {
          "direction": "AXIS2",
          "direction_sense": "NEGATIVE",
          "kind": "material_layer_set_usage",
          "layer_set_name": "M01",
          "layers": [
            {
              "name": "默认墙",
              "thickness": 240.0
            }
          ],
          "offset_from_reference_line": 120.0
        },
        "scope": "direct",
        "source": "user"
      },
      {
        "entity_id": "W006",
        "material": {
          "direction": "AXIS2",
          "direction_sense": "NEGATIVE",
          "kind": "material_layer_set_usage",
          "layer_set_name": "M01",
          "layers": [
            {
              "name": "默认墙",
              "thickness": 240.0
            }
          ],
          "offset_from_reference_line": 120.0
        },
        "scope": "direct",
        "source": "user"
      },
      {
        "entity_id": "W007",
        "material": {
          "direction": "AXIS2",
          "direction_sense": "NEGATIVE",
          "kind": "material_layer_set_usage",
          "layer_set_name": "M01",
          "layers": [
            {
              "name": "默认墙",
              "thickness": 240.0
            }
          ],
          "offset_from_reference_line": 120.0
        },
        "scope": "direct",
        "source": "user"
      },
      {
        "entity_id": "W008",
        "material": {
          "direction": "AXIS2",
          "direction_sense": "NEGATIVE",
          "kind": "material_layer_set_usage",
          "layer_set_name": "M01",
          "layers": [
            {
              "name": "默认墙",
              "thickness": 240.0
            }
          ],
          "offset_from_reference_line": 120.0
        },
        "scope": "direct",
        "source": "user"
      },
      {
        "entity_id": "W016",
        "material": {
          "direction": "AXIS2",
          "direction_sense": "NEGATIVE",
          "kind": "material_layer_set_usage",
          "layer_set_name": "M01",
          "layers": [
            {
              "name": "默认墙",
              "thickness": 240.0
            }
          ],
          "offset_from_reference_line": 120.0
        },
        "scope": "direct",
        "source": "user"
      },
      {
        "entity_id": "W017",
        "material": {
          "direction": "AXIS2",
          "direction_sense": "NEGATIVE",
          "kind": "material_layer_set_usage",
          "layer_set_name": "M01",
          "layers": [
            {
              "name": "默认墙",
              "thickness": 240.0
            }
          ],
          "offset_from_reference_line": 120.0
        },
        "scope": "direct",
        "source": "user"
      },
      {
        "entity_id": "W018",
        "material": {
          "direction": "AXIS2",
          "direction_sense": "NEGATIVE",
          "kind": "material_layer_set_usage",
          "layer_set_name": "M01",
          "layers": [
            {
              "name": "默认墙",
              "thickness": 240.0
            }
          ],
          "offset_from_reference_line": 120.0
        },
        "scope": "direct",
        "source": "user"
      },
      {
        "entity_id": "W019",
        "material": {
          "direction": "AXIS2",
          "direction_sense": "NEGATIVE",
          "kind": "material_layer_set_usage",
          "layer_set_name": "M01",
          "layers": [
            {
              "name": "默认墙",
              "thickness": 240.0
            }
          ],
          "offset_from_reference_line": 120.0
        },
        "scope": "direct",
        "source": "user"
      },
      {